{
  "$schema": "http://json-schema.org/draft-07/schema",
  "$id": "https://andreypudov.com/data/schemas/album.schema.json",

  "title": "Album",
  "description": "A schema representing a collection of artwork items in an album.",
  "type": "object",
  "properties": {
    "$schema": {
      "type": "string",
      "description": "The schema version."
    },
    "name": {
      "type": "string",
      "description": "The title of the album."
    },
    "description": {
      "type": "string",
      "description": "A description of the album."
    },
    "genre": {
      "type": "string",
      "enum": [
        "Nature",
        "Portrait",
        "Street",
        "Other"
      ],
      "description": "The genre of the album."
    },
    "cover": {
      "type": "string",
      "format": "uri-reference",
      "description": "The relative path to the artwork image."
    },
    "items": {
      "type": "array",
      "description": "A list of artwork items included in the album.",
      "items": {
        "$ref": "item.schema.json"
      },
      "minItems": 1
    }
  },
  "required": [
    "$schema",
    "name",
    "description",
    "genre",
    "cover",
    "items"
  ],
  "additionalProperties": false
}