{
  "$schema": "../schemas/album.schema.json",
  "name": "Pei Pei. Weekend in Madrid",
  "description": "",
  "genre": "Portrait",
  "cover": "/photographs/2024-04-10_30/2024-04-10_30_011.webp",
  "items": [
    {
      "name": "",
      "description": "",
      "path": "/photographs/2024-04-10_30/2024-04-10_30_001.webp",
      "orientation": "landscape",
      "date": "2024-04-30"
    },
    {
      "name": "",
      "description": "",
      "path": "/photographs/2024-04-10_30/2024-04-10_30_002.webp",
      "orientation": "portrait",
      "date": "2024-04-30"
    },
    {
      "name": "",
      "description": "",
      "path": "/photographs/2024-04-10_30/2024-04-10_30_003.webp",
      "orientation": "landscape",
      "date": "2024-04-30"
    },
    {
      "name": "",
      "description": "",
      "path": "/photographs/2024-04-10_30/2024-04-10_30_004.webp",
      "orientation": "landscape",
      "date": "2024-04-30"
    },
    {
      "name": "",
      "description": "",
      "path": "/photographs/2024-04-10_30/2024-04-10_30_005.webp",
      "orientation": "portrait",
      "date": "2024-04-30"
    },
    {
      "name": "",
      "description": "",
      "path": "/photographs/2024-04-10_30/2024-04-10_30_006.webp",
      "orientation": "portrait",
      "date": "2024-04-30"
    },
    {
      "name": "",
      "description": "",
      "path": "/photographs/2024-04-10_30/2024-04-10_30_007.webp",
      "orientation": "portrait",
      "date": "2024-04-30"
    },
    {
      "name": "",
      "description": "",
      "path": "/photographs/2024-04-10_30/2024-04-10_30_008.webp",
      "orientation": "portrait",
      "date": "2024-04-30"
    },
    {
      "name": "",
      "description": "",
      "path": "/photographs/2024-04-10_30/2024-04-10_30_009.webp",
      "orientation": "landscape",
      "date": "2024-04-30"
    },
    {
      "name": "",
      "description": "",
      "path": "/photographs/2024-04-10_30/2024-04-10_30_010.webp",
      "orientation": "portrait",
      "date": "2024-04-30"
    },
    {
      "name": "Pei Pei",
      "description": "Weekend in Madrid",
      "path": "/photographs/2024-04-10_30/2024-04-10_30_011.webp",
      "orientation": "landscape",
      "date": "2024-04-30"
    },
    {
      "name": "",
      "description": "",
      "path": "/photographs/2024-04-10_30/2024-04-10_30_012.webp",
      "orientation": "portrait",
      "date": "2024-04-30"
    },
    {
      "name": "",
      "description": "",
      "path": "/photographs/2024-04-10_30/2024-04-10_30_013.webp",
      "orientation": "portrait",
      "date": "2024-04-30"
    },
    {
      "name": "",
      "description": "",
      "path": "/photographs/2024-04-10_30/2024-04-10_30_014.webp",
      "orientation": "portrait",
      "date": "2024-04-30"
    },
    {
      "name": "",
      "description": "",
      "path": "/photographs/2024-04-10_30/2024-04-10_30_015.webp",
      "orientation": "portrait",
      "date": "2024-04-30"
    },
    {
      "name": "",
      "description": "",
      "path": "/photographs/2024-04-10_30/2024-04-10_30_016.webp",
      "orientation": "portrait",
      "date": "2024-04-30"
    },
    {
      "name": "",
      "description": "",
      "path": "/photographs/2024-04-10_30/2024-04-10_30_017.webp",
      "orientation": "landscape",
      "date": "2024-04-30"
    },
    {
      "name": "",
      "description": "",
      "path": "/photographs/2024-04-10_30/2024-04-10_30_018.webp",
      "orientation": "landscape",
      "date": "2024-04-30"
    },
    {
      "name": "",
      "description": "",
      "path": "/photographs/2024-04-10_30/2024-04-10_30_019.webp",
      "orientation": "portrait",
      "date": "2024-04-30"
    },
    {
      "name": "",
      "description": "",
      "path": "/photographs/2024-04-10_30/2024-04-10_30_020.webp",
      "orientation": "portrait",
      "date": "2024-04-30"
    },
    {
      "name": "",
      "description": "",
      "path": "/photographs/2024-04-10_30/2024-04-10_30_021.webp",
      "orientation": "portrait",
      "date": "2024-04-30"
    },
    {
      "name": "",
      "description": "",
      "path": "/photographs/2024-04-10_30/2024-04-10_30_022.webp",
      "orientation": "portrait",
      "date": "2024-04-30"
    },
    {
      "name": "",
      "description": "",
      "path": "/photographs/2024-04-10_30/2024-04-10_30_023.webp",
      "orientation": "portrait",
      "date": "2024-04-30"
    },
    {
      "name": "",
      "description": "",
      "path": "/photographs/2024-04-10_30/2024-04-10_30_024.webp",
      "orientation": "portrait",
      "date": "2024-04-30"
    }
  ]
}