{
  "$schema": "../schemas/album.schema.json",
  "name": "Castillo de Mataplana",
  "description": "",
  "genre": "Nature",
  "cover": "/photographs/2022-07-23_24/2022-07-23_24_008.webp",
  "items": [
    {
      "name": "",
      "description": "",
      "path": "/photographs/2022-07-23_24/2022-07-23_24_001.webp",
      "orientation": "landscape",
      "date": "2022-07-24"
    },
    {
      "name": "",
      "description": "",
      "path": "/photographs/2022-07-23_24/2022-07-23_24_002.webp",
      "orientation": "portrait",
      "date": "2022-07-24"
    },
    {
      "name": "",
      "description": "",
      "path": "/photographs/2022-07-23_24/2022-07-23_24_003.webp",
      "orientation": "landscape",
      "date": "2022-07-24"
    },
    {
      "name": "",
      "description": "",
      "path": "/photographs/2022-07-23_24/2022-07-23_24_004.webp",
      "orientation": "landscape",
      "date": "2022-07-24"
    },
    {
      "name": "",
      "description": "",
      "path": "/photographs/2022-07-23_24/2022-07-23_24_005.webp",
      "orientation": "landscape",
      "date": "2022-07-24"
    },
    {
      "name": "",
      "description": "",
      "path": "/photographs/2022-07-23_24/2022-07-23_24_006.webp",
      "orientation": "landscape",
      "date": "2022-07-24"
    },
    {
      "name": "",
      "description": "",
      "path": "/photographs/2022-07-23_24/2022-07-23_24_007.webp",
      "orientation": "landscape",
      "date": "2022-07-24"
    },
    {
      "name": "",
      "description": "",
      "path": "/photographs/2022-07-23_24/2022-07-23_24_008.webp",
      "orientation": "landscape",
      "date": "2022-07-24"
    },
    {
      "name": "",
      "description": "",
      "path": "/photographs/2022-07-23_24/2022-07-23_24_009.webp",
      "orientation": "landscape",
      "date": "2022-07-24"
    },
    {
      "name": "",
      "description": "",
      "path": "/photographs/2022-07-23_24/2022-07-23_24_010.webp",
      "orientation": "landscape",
      "date": "2022-07-24"
    },
    {
      "name": "",
      "description": "",
      "path": "/photographs/2022-07-23_24/2022-07-23_24_011.webp",
      "orientation": "landscape",
      "date": "2022-07-24"
    },
    {
      "name": "",
      "description": "",
      "path": "/photographs/2022-07-23_24/2022-07-23_24_012.webp",
      "orientation": "portrait",
      "date": "2022-07-24"
    },
    {
      "name": "",
      "description": "",
      "path": "/photographs/2022-07-23_24/2022-07-23_24_013.webp",
      "orientation": "portrait",
      "date": "2022-07-24"
    },
    {
      "name": "",
      "description": "",
      "path": "/photographs/2022-07-23_24/2022-07-23_24_014.webp",
      "orientation": "portrait",
      "date": "2022-07-24"
    },
    {
      "name": "",
      "description": "",
      "path": "/photographs/2022-07-23_24/2022-07-23_24_015.webp",
      "orientation": "landscape",
      "date": "2022-07-24"
    },
    {
      "name": "",
      "description": "",
      "path": "/photographs/2022-07-23_24/2022-07-23_24_016.webp",
      "orientation": "landscape",
      "date": "2022-07-24"
    },
    {
      "name": "",
      "description": "",
      "path": "/photographs/2022-07-23_24/2022-07-23_24_017.webp",
      "orientation": "landscape",
      "date": "2022-07-24"
    },
    {
      "name": "",
      "description": "",
      "path": "/photographs/2022-07-23_24/2022-07-23_24_018.webp",
      "orientation": "portrait",
      "date": "2022-07-24"
    },
    {
      "name": "",
      "description": "",
      "path": "/photographs/2022-07-23_24/2022-07-23_24_019.webp",
      "orientation": "landscape",
      "date": "2022-07-24"
    },
    {
      "name": "",
      "description": "",
      "path": "/photographs/2022-07-23_24/2022-07-23_24_020.webp",
      "orientation": "landscape",
      "date": "2022-07-24"
    },
    {
      "name": "",
      "description": "",
      "path": "/photographs/2022-07-23_24/2022-07-23_24_021.webp",
      "orientation": "landscape",
      "date": "2022-07-24"
    },
    {
      "name": "",
      "description": "",
      "path": "/photographs/2022-07-23_24/2022-07-23_24_022.webp",
      "orientation": "landscape",
      "date": "2022-07-24"
    },
    {
      "name": "",
      "description": "",
      "path": "/photographs/2022-07-23_24/2022-07-23_24_023.webp",
      "orientation": "landscape",
      "date": "2022-07-24"
    },
    {
      "name": "",
      "description": "",
      "path": "/photographs/2022-07-23_24/2022-07-23_24_024.webp",
      "orientation": "landscape",
      "date": "2022-07-24"
    },
    {
      "name": "",
      "description": "",
      "path": "/photographs/2022-07-23_24/2022-07-23_24_025.webp",
      "orientation": "portrait",
      "date": "2022-07-24"
    },
    {
      "name": "",
      "description": "",
      "path": "/photographs/2022-07-23_24/2022-07-23_24_026.webp",
      "orientation": "landscape",
      "date": "2022-07-24"
    },
    {
      "name": "",
      "description": "",
      "path": "/photographs/2022-07-23_24/2022-07-23_24_027.webp",
      "orientation": "portrait",
      "date": "2022-07-24"
    },
    {
      "name": "",
      "description": "",
      "path": "/photographs/2022-07-23_24/2022-07-23_24_028.webp",
      "orientation": "portrait",
      "date": "2022-07-24"
    },
    {
      "name": "",
      "description": "",
      "path": "/photographs/2022-07-23_24/2022-07-23_24_029.webp",
      "orientation": "landscape",
      "date": "2022-07-24"
    },
    {
      "name": "",
      "description": "",
      "path": "/photographs/2022-07-23_24/2022-07-23_24_030.webp",
      "orientation": "portrait",
      "date": "2022-07-24"
    },
    {
      "name": "",
      "description": "",
      "path": "/photographs/2022-07-23_24/2022-07-23_24_031.webp",
      "orientation": "portrait",
      "date": "2022-07-24"
    },
    {
      "name": "",
      "description": "",
      "path": "/photographs/2022-07-23_24/2022-07-23_24_032.webp",
      "orientation": "portrait",
      "date": "2022-07-24"
    },
    {
      "name": "",
      "description": "",
      "path": "/photographs/2022-07-23_24/2022-07-23_24_033.webp",
      "orientation": "portrait",
      "date": "2022-07-24"
    },
    {
      "name": "",
      "description": "",
      "path": "/photographs/2022-07-23_24/2022-07-23_24_034.webp",
      "orientation": "landscape",
      "date": "2022-07-24"
    },
    {
      "name": "",
      "description": "",
      "path": "/photographs/2022-07-23_24/2022-07-23_24_035.webp",
      "orientation": "portrait",
      "date": "2022-07-24"
    },
    {
      "name": "",
      "description": "",
      "path": "/photographs/2022-07-23_24/2022-07-23_24_036.webp",
      "orientation": "portrait",
      "date": "2022-07-24"
    },
    {
      "name": "",
      "description": "",
      "path": "/photographs/2022-07-23_24/2022-07-23_24_037.webp",
      "orientation": "portrait",
      "date": "2022-07-24"
    },
    {
      "name": "",
      "description": "",
      "path": "/photographs/2022-07-23_24/2022-07-23_24_038.webp",
      "orientation": "portrait",
      "date": "2022-07-24"
    },
    {
      "name": "",
      "description": "",
      "path": "/photographs/2022-07-23_24/2022-07-23_24_039.webp",
      "orientation": "portrait",
      "date": "2022-07-24"
    },
    {
      "name": "",
      "description": "",
      "path": "/photographs/2022-07-23_24/2022-07-23_24_040.webp",
      "orientation": "landscape",
      "date": "2022-07-24"
    },
    {
      "name": "",
      "description": "",
      "path": "/photographs/2022-07-23_24/2022-07-23_24_041.webp",
      "orientation": "portrait",
      "date": "2022-07-24"
    },
    {
      "name": "",
      "description": "",
      "path": "/photographs/2022-07-23_24/2022-07-23_24_042.webp",
      "orientation": "portrait",
      "date": "2022-07-24"
    },
    {
      "name": "",
      "description": "",
      "path": "/photographs/2022-07-23_24/2022-07-23_24_043.webp",
      "orientation": "landscape",
      "date": "2022-07-24"
    },
    {
      "name": "",
      "description": "",
      "path": "/photographs/2022-07-23_24/2022-07-23_24_044.webp",
      "orientation": "portrait",
      "date": "2022-07-24"
    },
    {
      "name": "",
      "description": "",
      "path": "/photographs/2022-07-23_24/2022-07-23_24_045.webp",
      "orientation": "portrait",
      "date": "2022-07-24"
    },
    {
      "name": "",
      "description": "",
      "path": "/photographs/2022-07-23_24/2022-07-23_24_046.webp",
      "orientation": "portrait",
      "date": "2022-07-24"
    },
    {
      "name": "",
      "description": "",
      "path": "/photographs/2022-07-23_24/2022-07-23_24_047.webp",
      "orientation": "landscape",
      "date": "2022-07-24"
    },
    {
      "name": "",
      "description": "",
      "path": "/photographs/2022-07-23_24/2022-07-23_24_048.webp",
      "orientation": "landscape",
      "date": "2022-07-24"
    },
    {
      "name": "",
      "description": "",
      "path": "/photographs/2022-07-23_24/2022-07-23_24_049.webp",
      "orientation": "portrait",
      "date": "2022-07-24"
    },
    {
      "name": "",
      "description": "",
      "path": "/photographs/2022-07-23_24/2022-07-23_24_050.webp",
      "orientation": "landscape",
      "date": "2022-07-24"
    }
  ]
}