{
  "$schema": "../schemas/album.schema.json",
  "name": "Asia Farakshina",
  "description": "",
  "genre": "Portrait",
  "cover": "/photographs/2015-08-14/2015-08-14_001.webp",
  "items": [
    {
      "name": "",
      "description": "",
      "path": "/photographs/2015-08-14/2015-08-14_001.webp",
      "orientation": "landscape",
      "date": "2015-08-14",
      "hidden": false
    },
    {
      "name": "",
      "description": "",
      "path": "/photographs/2015-08-14/2015-08-14_002.webp",
      "orientation": "portrait",
      "date": "2015-08-14",
      "hidden": true
    },
    {
      "name": "",
      "description": "",
      "path": "/photographs/2015-08-14/2015-08-14_003.webp",
      "orientation": "portrait",
      "date": "2015-08-14",
      "hidden": false
    },
    {
      "name": "",
      "description": "",
      "path": "/photographs/2015-08-14/2015-08-14_004.webp",
      "orientation": "landscape",
      "date": "2015-08-14",
      "hidden": true
    },
    {
      "name": "",
      "description": "",
      "path": "/photographs/2015-08-14/2015-08-14_005.webp",
      "orientation": "landscape",
      "date": "2015-08-14",
      "hidden": true
    },
    {
      "name": "",
      "description": "",
      "path": "/photographs/2015-08-14/2015-08-14_006.webp",
      "orientation": "landscape",
      "date": "2015-08-14",
      "hidden": false
    },
    {
      "name": "",
      "description": "",
      "path": "/photographs/2015-08-14/2015-08-14_007.webp",
      "orientation": "landscape",
      "date": "2015-08-14",
      "hidden": true
    },
    {
      "name": "",
      "description": "",
      "path": "/photographs/2015-08-14/2015-08-14_008.webp",
      "orientation": "portrait",
      "date": "2015-08-14",
      "hidden": true
    },
    {
      "name": "",
      "description": "",
      "path": "/photographs/2015-08-14/2015-08-14_009.webp",
      "orientation": "portrait",
      "date": "2015-08-14",
      "hidden": true
    },
    {
      "name": "",
      "description": "",
      "path": "/photographs/2015-08-14/2015-08-14_010.webp",
      "orientation": "landscape",
      "date": "2015-08-14",
      "hidden": true
    },
    {
      "name": "",
      "description": "",
      "path": "/photographs/2015-08-14/2015-08-14_011.webp",
      "orientation": "landscape",
      "date": "2015-08-14",
      "hidden": true
    },
    {
      "name": "",
      "description": "",
      "path": "/photographs/2015-08-14/2015-08-14_012.webp",
      "orientation": "landscape",
      "date": "2015-08-14",
      "hidden": true
    },
    {
      "name": "",
      "description": "",
      "path": "/photographs/2015-08-14/2015-08-14_013.webp",
      "orientation": "landscape",
      "date": "2015-08-14",
      "hidden": true
    },
    {
      "name": "",
      "description": "",
      "path": "/photographs/2015-08-14/2015-08-14_014.webp",
      "orientation": "landscape",
      "date": "2015-08-14",
      "hidden": true
    }
  ]
}