{
  "$schema": "../schemas/album.schema.json",
  "name": "Anna Zhykol",
  "description": "A refined studio portrait series featuring Anna in a simple and classic style.",
  "genre": "Portrait",
  "cover": "/photographs/2025-05-22/2025-05-22_026.webp",
  "items": [
    {
      "name": "",
      "description": "",
      "path": "/photographs/2025-05-22/2025-05-22_016.webp",
      "orientation": "landscape",
      "date": "2025-05-22"
    },
    {
      "name": "",
      "description": "",
      "path": "/photographs/2025-05-22/2025-05-22_017.webp",
      "orientation": "portrait",
      "date": "2025-05-22"
    },
    {
      "name": "",
      "description": "",
      "path": "/photographs/2025-05-22/2025-05-22_018.webp",
      "orientation": "portrait",
      "date": "2025-05-22"
    },
    {
      "name": "",
      "description": "",
      "path": "/photographs/2025-05-22/2025-05-22_019.webp",
      "orientation": "portrait",
      "date": "2025-05-22"
    },
    {
      "name": "",
      "description": "",
      "path": "/photographs/2025-05-22/2025-05-22_020.webp",
      "orientation": "portrait",
      "date": "2025-05-22"
    },
    {
      "name": "",
      "description": "",
      "path": "/photographs/2025-05-22/2025-05-22_021.webp",
      "orientation": "portrait",
      "date": "2025-05-22"
    },
    {
      "name": "",
      "description": "",
      "path": "/photographs/2025-05-22/2025-05-22_022.webp",
      "orientation": "portrait",
      "date": "2025-05-22"
    },
    {
      "name": "",
      "description": "",
      "path": "/photographs/2025-05-22/2025-05-22_023.webp",
      "orientation": "portrait",
      "date": "2025-05-22"
    },
    {
      "name": "",
      "description": "",
      "path": "/photographs/2025-05-22/2025-05-22_024.webp",
      "orientation": "portrait",
      "date": "2025-05-22"
    },
    {
      "name": "",
      "description": "",
      "path": "/photographs/2025-05-22/2025-05-22_025.webp",
      "orientation": "portrait",
      "date": "2025-05-22"
    },
    {
      "name": "Anna Zhykol",
      "description": "A refined studio portrait in a classic style.",
      "path": "/photographs/2025-05-22/2025-05-22_026.webp",
      "orientation": "portrait",
      "date": "2025-05-22"
    },
    {
      "name": "",
      "description": "",
      "path": "/photographs/2025-05-22/2025-05-22_027.webp",
      "orientation": "landscape",
      "date": "2025-05-22"
    },
    {
      "name": "",
      "description": "",
      "path": "/photographs/2025-05-22/2025-05-22_028.webp",
      "orientation": "portrait",
      "date": "2025-05-22"
    }
  ]
}