{
  "$schema": "../schemas/album.schema.json",

  "name": "The State Bank of Russia",
  "description": "The Nizhny Novgorod branch of the State Bank on Bolshaya Pokrovskaya Street is one of the most beautiful buildings in Nizhny Novgorod and the entire Volga region. It was built in 1913 to commemorate the 300th anniversary of the Romanovs' House. The ceiling in the building, for which the neo-Russian style was chosen, was painted by the famous artist Ivan Bilibin.",
  "genre": "Street",
  "cover": "",
  "items": [
    {
      "name": "",
      "description": "",
      "path": "https://player.vimeo.com/video/517762910",
      "orientation": "landscape",
      "date": "2017-04-14",
      "hidden": false
    }
  ]
}