{
  "$schema": "../schemas/album.schema.json",
  "name": "Looking for the Wind",
  "description": "",
  "genre": "Portrait",
  "cover": "/photographs/2018-05-27/2018-05-27_005.webp",
  "items": [
    {
      "name": "",
      "description": "",
      "path": "/photographs/2018-05-27/2018-05-27_003.webp",
      "orientation": "landscape",
      "date": "2018-05-27"
    },
    {
      "name": "",
      "description": "",
      "path": "/photographs/2018-05-27/2018-05-27_002.webp",
      "orientation": "landscape",
      "date": "2018-05-27"
    },
    {
      "name": "",
      "description": "",
      "path": "/photographs/2018-05-27/2018-05-27_006.webp",
      "orientation": "landscape",
      "date": "2018-05-27"
    },
    {
      "name": "",
      "description": "",
      "path": "/photographs/2018-05-27/2018-05-27_005.webp",
      "orientation": "landscape",
      "date": "2018-05-27"
    },
    {
      "name": "",
      "description": "",
      "path": "/photographs/2018-05-27/2018-05-27_001.webp",
      "orientation": "landscape",
      "date": "2018-05-27"
    },
    {
      "name": "",
      "description": "",
      "path": "/photographs/2018-05-27/2018-05-27_004.webp",
      "orientation": "landscape",
      "date": "2018-05-27"
    },
    {
      "name": "Andrey Sudakov",
      "description": "On the eve of a forecasted hurricane â€” a quiet moment before nature's force unfolds.",
      "path": "/photographs/2018-05-27/2018-05-27_007.webp",
      "orientation": "landscape",
      "date": "2018-05-27"
    },
    {
      "name": "",
      "description": "",
      "path": "/photographs/2018-05-27/2018-05-27_008.webp",
      "orientation": "portrait",
      "date": "2018-05-27"
    }
  ]
}