{
  "$schema": "../schemas/album.schema.json",
  "name": "Tur√≥ de l'Home",
  "description": "",
  "genre": "Nature",
  "cover": "/photographs/2022-08-07/2022-08-07_019.webp",
  "items": [
    {
      "name": "",
      "description": "",
      "path": "/photographs/2022-08-07/2022-08-07_001.webp",
      "orientation": "landscape",
      "date": "2022-08-07",
      "hidden": false
    },
    {
      "name": "",
      "description": "",
      "path": "/photographs/2022-08-07/2022-08-07_002.webp",
      "orientation": "landscape",
      "date": "2022-08-07",
      "hidden": false
    },
    {
      "name": "",
      "description": "",
      "path": "/photographs/2022-08-07/2022-08-07_003.webp",
      "orientation": "portrait",
      "date": "2022-08-07",
      "hidden": false
    },
    {
      "name": "",
      "description": "",
      "path": "/photographs/2022-08-07/2022-08-07_004.webp",
      "orientation": "landscape",
      "date": "2022-08-07",
      "hidden": false
    },
    {
      "name": "",
      "description": "",
      "path": "/photographs/2022-08-07/2022-08-07_005.webp",
      "orientation": "portrait",
      "date": "2022-08-07",
      "hidden": false
    },
    {
      "name": "",
      "description": "",
      "path": "/photographs/2022-08-07/2022-08-07_006.webp",
      "orientation": "portrait",
      "date": "2022-08-07",
      "hidden": false
    },
    {
      "name": "",
      "description": "",
      "path": "/photographs/2022-08-07/2022-08-07_007.webp",
      "orientation": "portrait",
      "date": "2022-08-07",
      "hidden": false
    },
    {
      "name": "",
      "description": "",
      "path": "/photographs/2022-08-07/2022-08-07_008.webp",
      "orientation": "landscape",
      "date": "2022-08-07",
      "hidden": false
    },
    {
      "name": "",
      "description": "",
      "path": "/photographs/2022-08-07/2022-08-07_009.webp",
      "orientation": "portrait",
      "date": "2022-08-07",
      "hidden": false
    },
    {
      "name": "",
      "description": "",
      "path": "/photographs/2022-08-07/2022-08-07_010.webp",
      "orientation": "landscape",
      "date": "2022-08-07",
      "hidden": false
    },
    {
      "name": "",
      "description": "",
      "path": "/photographs/2022-08-07/2022-08-07_011.webp",
      "orientation": "portrait",
      "date": "2022-08-07",
      "hidden": false
    },
    {
      "name": "",
      "description": "",
      "path": "/photographs/2022-08-07/2022-08-07_012.webp",
      "orientation": "landscape",
      "date": "2022-08-07",
      "hidden": false
    },
    {
      "name": "",
      "description": "",
      "path": "/photographs/2022-08-07/2022-08-07_013.webp",
      "orientation": "landscape",
      "date": "2022-08-07",
      "hidden": false
    },
    {
      "name": "",
      "description": "",
      "path": "/photographs/2022-08-07/2022-08-07_014.webp",
      "orientation": "landscape",
      "date": "2022-08-07",
      "hidden": false
    },
    {
      "name": "",
      "description": "",
      "path": "/photographs/2022-08-07/2022-08-07_015.webp",
      "orientation": "landscape",
      "date": "2022-08-07",
      "hidden": false
    },
    {
      "name": "",
      "description": "",
      "path": "/photographs/2022-08-07/2022-08-07_016.webp",
      "orientation": "landscape",
      "date": "2022-08-07",
      "hidden": false
    },
    {
      "name": "",
      "description": "",
      "path": "/photographs/2022-08-07/2022-08-07_017.webp",
      "orientation": "landscape",
      "date": "2022-08-07",
      "hidden": false
    },
    {
      "name": "",
      "description": "",
      "path": "/photographs/2022-08-07/2022-08-07_018.webp",
      "orientation": "portrait",
      "date": "2022-08-07",
      "hidden": false
    },
    {
      "name": "",
      "description": "The summit of Montseny offers sweeping views across Catalonia.",
      "path": "/photographs/2022-08-07/2022-08-07_019.webp",
      "orientation": "landscape",
      "date": "2022-08-07",
      "hidden": false
    },
    {
      "name": "",
      "description": "",
      "path": "/photographs/2022-08-07/2022-08-07_020.webp",
      "orientation": "landscape",
      "date": "2022-08-07",
      "hidden": false
    },
    {
      "name": "",
      "description": "",
      "path": "/photographs/2022-08-07/2022-08-07_021.webp",
      "orientation": "portrait",
      "date": "2022-08-07",
      "hidden": false
    },
    {
      "name": "",
      "description": "",
      "path": "/photographs/2022-08-07/2022-08-07_022.webp",
      "orientation": "landscape",
      "date": "2022-08-07",
      "hidden": false
    },
    {
      "name": "",
      "description": "",
      "path": "/photographs/2022-08-07/2022-08-07_023.webp",
      "orientation": "portrait",
      "date": "2022-08-07",
      "hidden": false
    },
    {
      "name": "",
      "description": "",
      "path": "/photographs/2022-08-07/2022-08-07_024.webp",
      "orientation": "portrait",
      "date": "2022-08-07",
      "hidden": false
    },
    {
      "name": "",
      "description": "",
      "path": "/photographs/2022-08-07/2022-08-07_025.webp",
      "orientation": "portrait",
      "date": "2022-08-07",
      "hidden": false
    },
    {
      "name": "",
      "description": "",
      "path": "/photographs/2022-08-07/2022-08-07_026.webp",
      "orientation": "landscape",
      "date": "2022-08-07",
      "hidden": false
    },
    {
      "name": "",
      "description": "",
      "path": "/photographs/2022-08-07/2022-08-07_027.webp",
      "orientation": "landscape",
      "date": "2022-08-07",
      "hidden": false
    },
    {
      "name": "",
      "description": "",
      "path": "/photographs/2022-08-07/2022-08-07_028.webp",
      "orientation": "landscape",
      "date": "2022-08-07",
      "hidden": false
    },
    {
      "name": "",
      "description": "",
      "path": "/photographs/2022-08-07/2022-08-07_029.webp",
      "orientation": "landscape",
      "date": "2022-08-07",
      "hidden": false
    },
    {
      "name": "",
      "description": "",
      "path": "/photographs/2022-08-07/2022-08-07_030.webp",
      "orientation": "landscape",
      "date": "2022-08-07",
      "hidden": false
    },
    {
      "name": "",
      "description": "",
      "path": "/photographs/2022-08-07/2022-08-07_031.webp",
      "orientation": "landscape",
      "date": "2022-08-07",
      "hidden": false
    }
  ]
}