{
  "$schema": "../schemas/album.schema.json",
  "name": "Tatyana Bysheva",
  "description": "",
  "genre": "Portrait",
  "cover": "/photographs/2017-07-22/2017-07-22_001.webp",
  "items": [
    {
      "name": "",
      "description": "",
      "path": "/photographs/2018-07-27/2018-07-27_001.webp",
      "orientation": "portrait",
      "date": "2018-07-27"
    },
    {
      "name": "",
      "description": "",
      "path": "/photographs/2018-07-27/2018-07-27_002.webp",
      "orientation": "portrait",
      "date": "2018-07-27"
    },
    {
      "name": "",
      "description": "",
      "path": "/photographs/2018-07-27/2018-07-27_003.webp",
      "orientation": "portrait",
      "date": "2018-07-27"
    },
    {
      "name": "",
      "description": "",
      "path": "/photographs/2018-07-27/2018-07-27_004.webp",
      "orientation": "portrait",
      "date": "2018-07-27"
    },
    {
      "name": "",
      "description": "",
      "path": "/photographs/2018-07-27/2018-07-27_005.webp",
      "orientation": "portrait",
      "date": "2018-07-27"
    },
    {
      "name": "",
      "description": "",
      "path": "/photographs/2018-07-27/2018-07-27_006.webp",
      "orientation": "portrait",
      "date": "2018-07-27"
    },
    {
      "name": "",
      "description": "",
      "path": "/photographs/2017-07-22/2017-07-22_001.webp",
      "orientation": "landscape",
      "date": "2017-07-22"
    },
    {
      "name": "",
      "description": "",
      "path": "/photographs/2017-07-22/2017-07-22_004.webp",
      "orientation": "landscape",
      "date": "2017-07-22"
    },
    {
      "name": "",
      "description": "",
      "path": "/photographs/2017-07-22/2017-07-22_005.webp",
      "orientation": "portrait",
      "date": "2017-07-22"
    },
    {
      "name": "",
      "description": "",
      "path": "/photographs/2017-07-22/2017-07-22_006.webp",
      "orientation": "portrait",
      "date": "2017-07-22"
    }
  ]
}